{
  "protocol": {
    "version": "1.0",
    "request_id": "22222222-2222-4222-8222-222222222225",
    "timestamp": "2026-08-02T14:00:00+00:00",
    "nonce": "EEEEEEEEEEEEEEEEEEEEEEEEEEEEEEEE"
  },
  "client": {
    "name": "zithis/licence-client",
    "version": "1.0.0",
    "supported_protocol_versions": [
      "1.0"
    ]
  },
  "product": {
    "code": "zithis",
    "package_identifier": "zithis/zithis.php",
    "installed_version": "1.1.27"
  },
  "installation": {
    "id": "11111111-1111-4111-8111-111111111111",
    "scope": "customer.example",
    "environment": "production",
    "canonical_uri": "https://customer.example"
  },
  "operation": {
    "name": "package_authorisation",
    "parameters": {
      "release_id": "release-zithis-1.1.28",
      "version": "1.1.28",
      "checksum_algorithm": "sha256",
      "checksum": "aaaaaaaaaaaaaaaaaaaaaaaaaaaaaaaaaaaaaaaaaaaaaaaaaaaaaaaaaaaaaaaa"
    }
  },
  "credential": {
    "activation_id": "33333333-3333-4333-8333-333333333333",
    "activation_secret": "SSSSSSSSSSSSSSSSSSSSSSSSSSSSSSSSSSSSSSSSSSS"
  }
}
